Error Code(s),Type,Title (EN),Description (EN),中文說明
12921,Warn,There is an unknown furniture ID,Please try again.,There is an unknown furniture ID — Please try again.
"13001, 13153, 13154, 14312, 14313",Error,Internal error,,內部錯誤（SDK bug）
13002,Warn,Internal error,,內部錯誤（SDK bug）
13003,Warn,Another task is running,,Another task is running
13004,Ignore,{action_name} has been canceled,,{action_name} has been canceled
"13005, 13151, 13152",Ignore,Internal error,,內部錯誤（SDK bug）
13101~13317 (81個),Error,Internal communication error,"If the problem persists after restarting Kachaka, please contact the customer service center.","Internal communication error — If the problem persists after restarting Kachaka, please con"
13157~14905 (14個),Error,Internal communication error,Please try again.,Internal communication error — Please try again.
"13172, 13174, 13175, 13176, 13179",Error,Failed to execute a task,Invalid request has been detected. Please update Kachaka and app to the latest version and try it again.,Failed to execute a task
"13185, 13187, 13189, 13192",Error,Failed to export a map,"If the problem persists after restarting Kachaka, please contact the customer service center.",Failed to export a map
"13186, 13188, 13190, 13191, 13193",Error,Failed to import a map,"If the problem persists after restarting Kachaka, please contact the customer service center.",Failed to import a map
13198,Error,Failed to start updating Kachaka software,Invalid request has been detected. Please update app to the latest version and try it again.,軟體更新失敗，請重啟後重試
"13201, 13202, 13203",Bug,Failed to execute a task,Invalid request has been detected. Please update Kachaka and app to the latest version and try it again.,Failed to execute a task
13204~14301 (34個),Error,Internal communication error,"Please try again. If the problem persists after restarting Kachaka, please contact the customer service center.",Internal communication error — Please try again. If the problem persists after restarting K
13207~13282 (38個),Error,Failed to execute a task,"Please try again after a while. If the problem persists, please restart Kachaka.",Failed to execute a task
"13208, 13209",Error,Failed to execute a task,The robot is in a state that does not accept the remote control. Please try again after a while.,Failed to execute a task
13210,Ignore,Invalid command,Invalid request has been detected. Please update Kachaka and app to the latest version and try it again.,Invalid command — Invalid request has been detected. Please update Kachaka and
"13211, 13212, 13213, 13214",Error,Invalid command,Invalid request has been detected. Please update Kachaka and app to the latest version and try it again.,Invalid command — Invalid request has been detected. Please update Kachaka and
13259,Error,実行に失敗しました,しばらくしてからもう一度お試しください。直らない場合は再起動してください。,実行に失敗しました — しばらくしてからもう一度お試しください。直らない場合は再起動してください。
"13283, 13284",Bug,Failed to execute a task,,Failed to execute a task
13285,Error,Execution failed,"Please try again after a while. If the problem persists, please restart Kachaka.",Execution failed
"13286, 13290",Error,Execution failed,"Please check your internet connection and try again later. If the problem persists, please restart Kachaka.",Execution failed
13287~13293 (6個),Error,Execution failed,Please check your internet connection and try again later.,Execution failed
13302,Error,Failed to set volume,An out-of-range setting value was entered. Please check the setting value and try again.,Failed to set volume
13303,Error,Failed to set carefulness of movement,An out-of-range setting value was entered. Please check the setting value and try again.,Failed to set carefulness of movement
13304,Error,Failed to set movement speed,An out-of-range setting value was entered. Please check the setting value and try again.,Failed to set movement speed
13311,Error,Size limit error,"If the problem persists after restarting Kachaka, please contact the customer service center.","Size limit error — If the problem persists after restarting Kachaka, please con"
13318,Warn,Wi-Fi setup failed,"If the problem persists after restarting Kachaka, please contact the customer service center.",Wi-Fi setup failed
"13319, 13330, 13331",Warn,Internal communication error,"If the problem persists after restarting Kachaka, please contact the customer service center.","Internal communication error — If the problem persists after restarting Kachaka, please con"
13324,Error,Execution failed,Please try again.,Execution failed
"14001, 14004",Error,Failed to add a routine,Please try again.,Failed to add a routine
"14002, 14003",Error,Routine not found,The specified routine does not exist.,Routine not found — The specified routine does not exist.
14101~14206 (9個),Error,Failed to execute a task,Please try again.,Failed to execute a task
"14102, 14202, 14204",Bug,Failed to execute a task,Please try again.,Failed to execute a task
14110,Ignore,Cancelled,,Cancelled
14113,Warn,一時停止しています,電源ボタンを押して解除してください。,一時停止しています — 電源ボタンを押して解除してください。
14114,Error,エラーが発生しました,もう一度お試しください,エラーが発生しました — もう一度お試しください
14205,Ignore,Failed to execute a task,,Failed to execute a task
"14207, 14208",Ignore,Failed to move the task,,移動失敗
14209,Warn,Running item cannot be moved,,Running item cannot be moved
14314,Error,Voice command is not set,,Voice command is not set
"14315, 14316, 14317",Error,Disabled triggers,,Disabled triggers
14319,Error,Failed to set time trigger,The date and time set is in the past. Please set a date and time that is at least one minute in the future.,Failed to set time trigger
14320,Error,Failed to set time trigger,Please select one or more days of the week.,Failed to set time trigger
14402,Error,File size is too large,,File size is too large
14403,Error,Insufficient disk space,,Insufficient disk space
"14404, 14405",Error,The specified sound is not found,,The specified sound is not found
14406,Error,Unsupported file format,,Unsupported file format
"14407, 14408",Error,Failed to save the file,The file may be corrupted. Please check and try again.,地圖儲存失敗，請重試
14409,Error,プリセット音源を編集することはできません,,プリセット音源を編集することはできません
14410,Error,プリセット音源を削除することはできません,,プリセット音源を削除することはできません
14451,Error,指定した音源は存在しません,もう一度お試しください。,指定した音源は存在しません — もう一度お試しください。
14501,Error,Failed to retrieve information,"Please try again. If the problem persists after restarting Kachaka, please contact the customer service center.",Failed to retrieve information
14601,Error,No furniture is registered,,No furniture is registered
"14602, 14603",Error,Failed to put back the shelf,,Failed to put back the shelf
14604,Error,Failed to charge,,充電失敗
14605,Error,Furniture cannot be placed on the charging dock,,Furniture cannot be placed on the charging dock
14607,Error,Failed to get away from the shelf,,無法離開傢俱，請確認周圍空間足夠
"14701, 14801",Error,内部通信エラー,,内部通信エラー
"14702, 14703, 14705, 14706",Error,実行に失敗しました,,実行に失敗しました
14704,Error,"Some unreachable waypoints, or start or goal location.",開始点／目的点／経由点のいずれかに、カチャカが到達できない地点があります。,"Some unreachable waypoints, or start or goal location. — 開始点／目的点／経由点のいずれかに、カチャカが到達できない地点があります。"
14707,Error,"You need to modify start/goal location, or some waypoints properly.",走行ルートの再作成に失敗しました。目的地または走行ルート設定の経由点を適切な位置に変更して下さい。,"You need to modify start/goal location, or some waypoints properly. — 走行ルートの再作成に失敗しました。目的地または走行ルート設定の経由点を適切な位置に変更して下さい。"
14802,Error,"Some unreachable waypoints, or start or goal location.",開始点／目的地点／経由点のいずれかに、カチャカが到達できない地点があります。,"Some unreachable waypoints, or start or goal location. — 開始点／目的地点／経由点のいずれかに、カチャカが到達できない地点があります。"
14803,Error,地点が削除されました,地点が削除され走行ルートを設定できなくなりました。同時に操作してるアプリがないか確認してください。,地点が削除されました — 地点が削除され走行ルートを設定できなくなりました。同時に操作してるアプリがないか確認してください。
14804,Error,Unreachable from the start location to the goal location.,開始点から目的地点へカチャカが到達できません。,Unreachable from the start location to the goal location. — 開始点から目的地点へカチャカが到達できません。
14805,Error,The waypoint is unreachable.,経由点にカチャカが到達できません。,The waypoint is unreachable. — 経由点にカチャカが到達できません。
14806,Error,No driving route found between the two points. modify the points and retry.,2点間の経路を作成できません。障害物や禁止エリアで塞がれないよう適切な位置に端点を置いてください。,No driving route found between the two points. modify the points and retry. — 2点間の経路を作成できません。障害物や禁止エリアで塞がれないよう適切な位置に端点を置いてください。
15104,Error,Server is busy,Please try again.,Server is busy — Please try again.
15106,Error,An error has occurred,"Please try again. If it fails repeatedly, check your internet connection, restart your console, and then try again.",發生錯誤，需重新啟動機器人
"15109, 15113",Error,Software update required,Please check for updates to your Cachaca software and try again.,Software update required — Please check for updates to your Cachaca software and try ag
15112,Error,Server is busy,please try again.,Server is busy — please try again.
"15115, 15502, 15506",Error,エラーが発生しました,もう一度お試しください。,エラーが発生しました — もう一度お試しください。
15501,Error,うまく動けませんでした,Check that there are no obstacles around.,うまく動けませんでした — Check that there are no obstacles around.
"15503, 15505",Error,うまく動けませんでした,まわりに障害物がないか確認してください。,うまく動けませんでした — まわりに障害物がないか確認してください。
15504,Error,充電ドックから離れられませんでした,まわりに障害物がないか確認してください。,充電ドックから離れられませんでした — まわりに障害物がないか確認してください。
"15507, 15508",Error,パラメータが不正です,設定を確認して、もう一度お試しください,パラメータが不正です — 設定を確認して、もう一度お試しください
15602,Error,Couldn't load furniture,Please try again.,Couldn't load furniture — Please try again.
15603,Error,Failed to obtain self-location,Please try again.,Failed to obtain self-location
15604,Error,The furniture came off,Please try again.,The furniture came off — Please try again.
15701,Error,There is no specified floor plan,Please try again.,There is no specified floor plan — Please try again.
"15801, 15802",Error,An error has occurred,Please check your settings and try again,發生錯誤，請重試
15803,Error,This feature is not available,This function is not supported by the version of Cachaca you are using.,This feature is not available — This function is not supported by the version of Cachaca you
15804,Warn,Wi-Fi setup is already running,,Wi-Fi setup is already running
"15901, 15902",Error,Internal communication error,"Please try again. If restarting does not resolve the issue, please contact our customer service center.","Internal communication error — Please try again. If restarting does not resolve the issue, "
15903,Error,Configuration failed,Please try again.,Configuration failed
15904,Error,設定に失敗しました,もう一度お試しください。,設定に失敗しました — もう一度お試しください。
"19001, 19002",Warn,Failed to move to the destination,Please check if there are any obstacles around Kachaka.,移動失敗，路徑上有障礙物
19003,Error,{shelf} has come off,Please try again.,{shelf} has come off — Please try again.
19004,Warn,Failed to move to the destination,Kachaka stops here because an obstacle is at the destination.,移動失敗，路徑上有障礙物
20100,Warn,Internal clock is not synchronized,The time synchronization failed at startup. Some functions such as the schedule function are disabled. Please reboot in a state where Kachaka can connect to the internet and set the time correctly. (Time synchronization is done automatically when Kachaka starts up with an access to the internet.),Internal clock is not synchronized — The time synchronization failed at startup. Some functions s
21001,Recoverable,Please wait a moment,"An error occurred on the front camera. Please restart Kachaka. If the problem persists, please contact the customer service center.",Please wait a moment — An error occurred on the front camera. Please restart Kachak
21002,Recoverable,Please wait a moment,"An error occurred on the baack camera. Please restart Kachaka. If the problem persists, please contact the customer service center.",Please wait a moment — An error occurred on the baack camera. Please restart Kachak
21003,Recoverable,Please wait a moment,"An error occurred on the 3D sensor. Please restart Kachaka. If the problem persists, please contact the customer service center.",Please wait a moment — An error occurred on the 3D sensor. Please restart Kachaka. 
21004,Fatal,A hardware error has occurred,"An error occurred on the laser sensor. Please restart Kachaka. If the problem persists, please contact the customer service center.",硬體錯誤，重啟後仍有問題請聯繫客服
21005,Error,Laser Sensor Error,Please make sure the laser sensor is not covered.,Laser Sensor Error — Please make sure the laser sensor is not covered.
21006,Fatal,Map loading error,"An error has occurred. Please restart Kachaka. If the problem persists, please contact the customer service center.",Map loading error — An error has occurred. Please restart Kachaka. If the proble
"21010, 21020",Fatal,A hardware error has occurred,"An error has occurred. Please restart Kachaka. If the problem persists, please contact the customer service center.",硬體錯誤，重啟後仍有問題請聯繫客服
21030~21080 (6個),Fatal,A hardware error has occurred,"An error has occurred. Please restart the device. If restarting the device does not resolve the issue, please contact our customer service center.",硬體錯誤，重啟後仍有問題請聯繫客服
21041,Error,Failed to charge,"The charging terminal may be dirty. Turn off the power of Kachaka and the charger and clean the charging terminal. If this message is displayed again after cleaning, please contact the customer service center.",充電失敗
21042,Ignore,A hardware error has occurred,An error occurred on the battery. Please contact the customer service center.,硬體錯誤，重啟後仍有問題請聯繫客服
21054,CallForSupport,A hardware error has occurred,An error occurred on the battery. Please contact the customer service center.,硬體錯誤，重啟後仍有問題請聯繫客服
"21055, 21056",Error,Motor Error,"The motor detected a large force. Please check if there is any foreign object stuck in the tire. If there is any foreign object, please remove it. Please press the power button to resume from the pause state.",Motor Error — The motor detected a large force. Please check if there is a
"21060, 21061",Error,CPU performance is low,We are temporarily unable to accept instructions. Please wait a moment.,CPU performance is low — We are temporarily unable to accept instructions. Please wai
21090,Error,A hardware error has occurred,"An error has occurred. Please restart the device. If restarting the device does not resolve the issue, please contact our customer service center.",硬體錯誤，重啟後仍有問題請聯繫客服
21091,Error,There is no free space in the system storage area,"An error has occurred. Please restart the device. If restarting the device does not resolve the issue, please contact our customer service center.",There is no free space in the system storage area — An error has occurred. Please restart the device. If restart
21092,Error,There is no free storage space,Please remove the unused map and increase the vacant space.,There is no free storage space — Please remove the unused map and increase the vacant space.
"21100, 21110",Fatal,A hardware error has occurred,"An error occurred on the battery. Please restart Kachaka. If the problem persists, please contact the customer service center.",硬體錯誤，重啟後仍有問題請聯繫客服
21101,Error,High battery temperature,Please turn off the power of Kachaka. Please make sure that the room temperature has reached the appropriate temperature and restart Kachaka.,High battery temperature — Please turn off the power of Kachaka. Please make sure that 
21102,Error,Low battery temperature,Please turn off the power of Kachaka. Please make sure that the room temperature has reached the appropriate temperature and restart Kachaka.,電量過低
21111,Warn,High battery temperature,The battery has become too hot to charge temporarily. Charging will automatically resume when the battery cools down.,High battery temperature — The battery has become too hot to charge temporarily. Chargi
21120,Fatal,A hardware error has occurred,"An error occurred on the sensor. Please restart Kachaka. If the problem persists, please contact the customer service center.",硬體錯誤，重啟後仍有問題請聯繫客服
"21130, 21140, 21150, 21160",Fatal,A hardware error has occurred,"An error occurred on the motor. Please restart Kachaka. If the problem persists, please contact the customer service center.",硬體錯誤，重啟後仍有問題請聯繫客服
"21141, 21161",Error,Motor high temperature,The motor is hot. Please turn off the power of Kachaka and wait until the temperature drops.,馬達過熱，請關閉電源等待降溫
"21170, 21180, 21200, 21210, 21220",Fatal,An error has occurred,Please reboot.,An error has occurred — Please reboot.
21190,Recoverable,Please wait a moment,"An error has occurred. Attempting recovery. If the error persists for more than 10 minutes, please restart the computer.",Please wait a moment — An error has occurred. Attempting recovery. If the error per
21230,Fatal,An error has occurred,"An error occurred on the front camera. Please restart Kachaka. If the problem persists, please contact the customer service center.",發生錯誤，需重新啟動機器人
21231,Fatal,An error has occurred,"An error occurred on the baack camera. Please restart Kachaka. If the problem persists, please contact the customer service center.",發生錯誤，需重新啟動機器人
21232,Fatal,An error has occurred,"An error occurred on the 3D sensor. Please restart Kachaka. If the problem persists, please contact the customer service center.",發生錯誤，需重新啟動機器人
21233,Fatal,An error has occurred,"An error occurred, please restart.",發生錯誤，需重新啟動機器人
22001,Error,Unable to find a route to the destination,Please check if there are any obstacles around Kachaka.,Unable to find a route to the destination — Please check if there are any obstacles around Kachaka.
22002,Error,Unable to pass the road,The route was narrow and Kachaka did not reach the destination. Please remove the surrounding obstacles.,Unable to pass the road — The route was narrow and Kachaka did not reach the destinati
23001,Error,Battery is empty,"Kachaka is returning to the charging dock because the battery is empty. If Kachaka cannot automatically return to the charging dock, place it on the charging dock by hand.",Battery is empty — Kachaka is returning to the charging dock because the batter
23002,Warn,Battery is low,,電量過低
24001,Warn,The furniture has already been registered,The registration of this furniture is skipped because it has already been registered.,The furniture has already been registered — The registration of this furniture is skipped because it has
"24002, 24003",Error,Non-genuine furniture is found,Kachaka found a furniture that seems to be non-genuine. It cannot be registered.,Non-genuine furniture is found — Kachaka found a furniture that seems to be non-genuine. It c
1000006,Warn,test_ui_title,,test_ui_title
